{
  "$schema": "./schema.json",
  "version": "1.0.0-alpha",
  "locale": "tr_TR",
  "source": "docs/command-plan.md",
  "groups": [
    { "key": "dosya", "label": "Dosya & Dizin", "glyph": "⎘", "order": 1 },
    { "key": "sistem", "label": "Sistem", "glyph": "◎", "order": 2 },
    { "key": "ag", "label": "Ağ", "glyph": "≈", "order": 3 },
    { "key": "paket", "label": "Paket & Pazar", "glyph": "⌂", "order": 4 },
    { "key": "metin", "label": "Metin", "glyph": "¶", "order": 5 },
    { "key": "git", "label": "Git", "glyph": "⎇", "order": 6 },
    { "key": "ai", "label": "Yapay Zekâ", "glyph": "K", "order": 7 }
  ],
  "commands": [
    { "id": "ls", "posix": "ls", "kapitan": "listele", "short": "lst", "description": "Dizindeki dosyaları listele", "group": "dosya", "phase": 1, "implemented": false },
    {
      "id": "cd",
      "posix": "cd",
      "kapitan": "gir",
      "short": "gr",
      "description": "Çalışma dizinini değiştir",
      "group": "dosya",
      "phase": 1,
      "implemented": false,
      "replaces": { "kapitan": "git", "short": "gt", "reason": "git VCS çakışması" },
      "collision_warnings": [
        {
          "type": "legacy_alias",
          "conflicts_with": "git",
          "severity": "critical",
          "message": "Eski 'cd' alias'ı 'git' ile çakışıyordu; 'gir' kullanın."
        }
      ]
    },
    { "id": "pwd", "posix": "pwd", "kapitan": "nerede", "short": "nr", "description": "Şu anki dizini yazdır", "group": "dosya", "phase": 1, "implemented": false },
    { "id": "mkdir", "posix": "mkdir", "kapitan": "klasör", "short": "kls", "description": "Yeni klasör oluştur", "group": "dosya", "phase": 1, "implemented": false },
    {
      "id": "rmdir",
      "posix": "rmdir",
      "kapitan": "sök",
      "short": "sk",
      "description": "Boş klasörü kaldır",
      "group": "dosya",
      "phase": 1,
      "implemented": false,
      "replaces": { "kapitan": "klasörsil", "short": "klss", "reason": "bileşik alias yerine doğal fiil" }
    },
    { "id": "cp", "posix": "cp", "kapitan": "kopyala", "short": "kp", "description": "Dosya ya da klasör kopyala", "group": "dosya", "phase": 1, "implemented": false },
    { "id": "mv", "posix": "mv", "kapitan": "taşı", "short": "tş", "description": "Dosya ya da klasör taşı", "group": "dosya", "phase": 1, "implemented": false },
    { "id": "rm", "posix": "rm", "kapitan": "sil", "short": "sl", "description": "Dosya ya da klasör sil", "group": "dosya", "phase": 1, "implemented": false },
    { "id": "touch", "posix": "touch", "kapitan": "oluştur", "short": "olş", "description": "Boş dosya oluştur ya da zaman damgasını güncelle", "group": "dosya", "phase": 1, "implemented": false },
    { "id": "cat", "posix": "cat", "kapitan": "oku", "short": "ok", "description": "Dosya içeriğini ekrana yazdır", "group": "dosya", "phase": 1, "implemented": false },
    { "id": "find", "posix": "find", "kapitan": "bul", "short": "bl", "description": "Dosya sisteminde dosya ara", "group": "dosya", "phase": 1, "implemented": false },
    {
      "id": "ln",
      "posix": "ln",
      "kapitan": "bağla",
      "short": "bğ",
      "description": "Sembolik ya da sabit bağlantı oluştur",
      "group": "dosya",
      "phase": 1,
      "implemented": false,
      "collision_warnings": [
        {
          "type": "short_ambiguity",
          "conflicts_with": "bağlan",
          "severity": "warning",
          "message": "Kısa alias 'bğ' ile 'bağlan' (ssh) aynı önek paylaşır."
        }
      ]
    },

    { "id": "uname", "posix": "uname", "kapitan": "sistem", "short": "sis", "description": "İşletim sistemi bilgisini yazdır", "group": "sistem", "phase": 1, "implemented": false },
    { "id": "top", "posix": "top", "kapitan": "canlı", "short": "cnl", "description": "Çalışan işlemleri canlı izle", "group": "sistem", "phase": 1, "implemented": false },
    { "id": "ps", "posix": "ps", "kapitan": "işlemler", "short": "işl", "description": "Anlık işlem listesini göster", "group": "sistem", "phase": 1, "implemented": false },
    { "id": "kill", "posix": "kill", "kapitan": "durdur", "short": "drd", "description": "Bir işlemi sonlandır", "group": "sistem", "phase": 1, "implemented": false },
    { "id": "df", "posix": "df", "kapitan": "disk", "short": "dsk", "description": "Disk doluluğunu göster", "group": "sistem", "phase": 1, "implemented": false },
    { "id": "du", "posix": "du", "kapitan": "boyut", "short": "byt", "description": "Klasör disk boyutunu hesapla", "group": "sistem", "phase": 1, "implemented": false },
    { "id": "free", "posix": "free", "kapitan": "bellek", "short": "blk", "description": "RAM ve takas bellek kullanımını göster", "group": "sistem", "phase": 1, "implemented": false },
    { "id": "shutdown", "posix": "shutdown", "kapitan": "kapat", "short": "kpt", "description": "Sistemi kapat", "group": "sistem", "phase": 1, "implemented": false },
    {
      "id": "reboot",
      "posix": "reboot",
      "kapitan": "yenile",
      "short": "yn",
      "description": "Sistemi yeniden başlat",
      "group": "sistem",
      "phase": 1,
      "implemented": false,
      "replaces": { "kapitan": "yeniden", "short": "yn", "reason": "zarf yerine emir kipi" }
    },
    { "id": "date", "posix": "date", "kapitan": "tarih", "short": "trh", "description": "Tarih ve saati göster", "group": "sistem", "phase": 1, "implemented": false },
    { "id": "whoami", "posix": "whoami", "kapitan": "benim", "short": "ben", "description": "Aktif kullanıcı adını göster", "group": "sistem", "phase": 1, "implemented": false },
    { "id": "history", "posix": "history", "kapitan": "geçmiş", "short": "gcş", "description": "Komut geçmişini listele", "group": "sistem", "phase": 1, "implemented": false },

    { "id": "ping", "posix": "ping", "kapitan": "dene", "short": "dn", "description": "Bir sunucuya erişimi sına", "group": "ag", "phase": 1, "implemented": false },
    { "id": "curl", "posix": "curl", "kapitan": "iste", "short": "ist", "description": "HTTP isteği gönder", "group": "ag", "phase": 1, "implemented": false },
    { "id": "wget", "posix": "wget", "kapitan": "indir", "short": "ind", "description": "Bağlantıdan dosya indir", "group": "ag", "phase": 1, "implemented": false },
    { "id": "ip-a", "posix": "ip a", "kapitan": "ağ", "short": "ağ", "description": "Ağ arayüzlerini listele", "group": "ag", "phase": 1, "implemented": false },
    { "id": "ssh", "posix": "ssh", "kapitan": "bağlan", "short": "bğl", "description": "Uzak sunucuya güvenli bağlan", "group": "ag", "phase": 1, "implemented": false },
    {
      "id": "scp",
      "posix": "scp",
      "kapitan": "aktar",
      "short": "akt",
      "description": "Uzak sunucuya dosya aktar",
      "group": "ag",
      "phase": 1,
      "implemented": false,
      "replaces": { "kapitan": "uzakkopyala", "short": "uzk", "reason": "uzun bileşik alias yerine tek kelime" }
    },
    { "id": "hostname", "posix": "hostname", "kapitan": "sunucu", "short": "snv", "description": "Makine adını göster", "group": "ag", "phase": 1, "implemented": false },
    { "id": "netstat", "posix": "netstat", "kapitan": "bağlantı", "short": "bnt", "description": "Ağ bağlantılarını listele", "group": "ag", "phase": 1, "implemented": false },

    { "id": "apt-install", "posix": "apt install", "kapitan": "kur", "short": "kr", "description": "Pazardan yazılım kur", "group": "paket", "phase": 1, "implemented": false },
    { "id": "apt-remove", "posix": "apt remove", "kapitan": "kaldır", "short": "kld", "description": "Kurulu yazılımı kaldır", "group": "paket", "phase": 1, "implemented": false },
    { "id": "apt-update", "posix": "apt update", "kapitan": "güncelle", "short": "gnc", "description": "Paket listesini güncelle", "group": "paket", "phase": 1, "implemented": false },
    { "id": "apt-upgrade", "posix": "apt upgrade", "kapitan": "yükselt", "short": "yks", "description": "Tüm yazılımları en son sürüme yükselt", "group": "paket", "phase": 1, "implemented": false },
    {
      "id": "apt-search",
      "posix": "apt search",
      "kapitan": "tara",
      "short": "tr",
      "description": "Pazarda yazılım ara",
      "group": "paket",
      "phase": 1,
      "implemented": false,
      "replaces": { "kapitan": "pazarara", "short": "pza", "reason": "bileşik alias yerine doğal fiil" }
    },
    { "id": "apt-list", "posix": "apt list", "kapitan": "kurulu", "short": "krl", "description": "Kurulu yazılımları listele", "group": "paket", "phase": 1, "implemented": false },
    { "id": "apt-show", "posix": "apt show", "kapitan": "incele", "short": "inc", "description": "Yazılım hakkında detay göster", "group": "paket", "phase": 1, "implemented": false },

    { "id": "grep", "posix": "grep", "kapitan": "ara", "short": "ar", "description": "Dosya içeriğinde metin ara", "group": "metin", "phase": 1, "implemented": false },
    { "id": "head", "posix": "head", "kapitan": "baş", "short": "bş", "description": "Dosyanın ilk satırlarını göster", "group": "metin", "phase": 1, "implemented": false },
    { "id": "tail", "posix": "tail", "kapitan": "son", "short": "sn", "description": "Dosyanın son satırlarını göster", "group": "metin", "phase": 1, "implemented": false },
    { "id": "sort", "posix": "sort", "kapitan": "sırala", "short": "srl", "description": "Satırları alfabetik ya da sayısal sırala", "group": "metin", "phase": 1, "implemented": false },
    { "id": "wc", "posix": "wc", "kapitan": "say", "short": "sy", "description": "Satır, kelime ve karakter sayısını göster", "group": "metin", "phase": 1, "implemented": false },
    { "id": "diff", "posix": "diff", "kapitan": "fark", "short": "frk", "description": "İki dosya arasındaki farkı göster", "group": "metin", "phase": 1, "implemented": false },
    { "id": "sed", "posix": "sed", "kapitan": "değiştir", "short": "dğş", "description": "Metin içinde bul-değiştir işlemi yap", "group": "metin", "phase": 1, "implemented": false },